{"contract_hash": "8ce024da65cb6f4e", "created_at": "2026-06-30T03:14:39Z", "description": "cycle 1 kept: worker default 12 improved mean_wall_clock_seconds to 9.068289", "git": {"branch": "autoresearch/speed-up-check-all-movies-20260630", "commit": "71946ee", "status": "M autoResearch/studies/speed-up-check-all-movies/runs.jsonl\n M autoResearch/studies/speed-up-check-all-movies/sessions.jsonl\n M autoResearch/studies/speed-up-check-all-movies/state.json"}, "id": "decision-d3d316b9", "metric": 9.068289, "metric_name": "mean_wall_clock_seconds", "run_id": "20260630-061358-58d8994c", "session_id": "session-20260630-061324-b2daabb2", "status": "keep", "worker_id": null}
{"contract_hash": "8ce024da65cb6f4e", "created_at": "2026-06-30T03:16:02Z", "description": "cycle 2 kept: worker default 10 improved mean_wall_clock_seconds to 6.353633", "git": {"branch": "autoresearch/speed-up-check-all-movies-20260630", "commit": "7155664", "status": "M autoResearch/studies/speed-up-check-all-movies/decisions.jsonl\n M autoResearch/studies/speed-up-check-all-movies/runs.jsonl\n M autoResearch/studies/speed-up-check-all-movies/sessions.jsonl\n M autoResearch/studies/speed-up-check-all-movies/state.json\n?? autoResearch/studies/speed-up-check-all-movies/reports/progress.svg\n?? autoResearch/studies/speed-up-check-all-movies/reports/summary.md"}, "id": "decision-a30203ab", "metric": 6.353633, "metric_name": "mean_wall_clock_seconds", "run_id": "20260630-061533-0f2eb8b9", "session_id": "session-20260630-061324-b2daabb2", "status": "keep", "worker_id": null}
{"contract_hash": "8ce024da65cb6f4e", "created_at": "2026-06-30T03:18:38Z", "description": "cycle 3 kept: worker default 8 improved mean_wall_clock_seconds to 6.085898", "git": {"branch": "autoresearch/speed-up-check-all-movies-20260630", "commit": "bbb7630", "status": "M autoResearch/studies/speed-up-check-all-movies/runs.jsonl"}, "id": "decision-0a4ad445", "metric": 6.085898, "metric_name": "mean_wall_clock_seconds", "run_id": "20260630-061802-23111926", "session_id": "session-20260630-061324-b2daabb2", "status": "keep", "worker_id": null}
{"contract_hash": "8ce024da65cb6f4e", "created_at": "2026-06-30T03:20:03Z", "description": "cycle 4 discarded: worker default 6 regressed mean_wall_clock_seconds to 8.203163", "git": {"branch": "autoresearch/speed-up-check-all-movies-20260630", "commit": "0accc83", "status": "M autoResearch/studies/speed-up-check-all-movies/runs.jsonl"}, "id": "decision-aae47d45", "metric": 8.203163, "metric_name": "mean_wall_clock_seconds", "run_id": "20260630-061924-e26ea7a2", "session_id": "session-20260630-061324-b2daabb2", "status": "discard", "worker_id": null}
{"contract_hash": "8ce024da65cb6f4e", "created_at": "2026-06-30T03:21:05Z", "description": "cycle 5 discarded: worker default 9 regressed mean_wall_clock_seconds to 9.265348", "git": {"branch": "autoresearch/speed-up-check-all-movies-20260630", "commit": "861f422", "status": "M autoResearch/studies/speed-up-check-all-movies/decisions.jsonl\n M autoResearch/studies/speed-up-check-all-movies/runs.jsonl"}, "id": "decision-43094bd1", "metric": 9.265348, "metric_name": "mean_wall_clock_seconds", "run_id": "20260630-062026-148b2e25", "session_id": "session-20260630-061324-b2daabb2", "status": "discard", "worker_id": null}
{"contract_hash": "8ce024da65cb6f4e", "created_at": "2026-06-30T03:52:23Z", "description": "cycle 6 discarded: seed-sorted pagination stop regressed mean_wall_clock_seconds to 7.758043", "git": {"branch": "autoresearch/speed-up-check-all-movies-20260630-resume", "commit": "9cf382d", "status": "M autoResearch/studies/speed-up-check-all-movies/runs.jsonl\n M autoResearch/studies/speed-up-check-all-movies/sessions.jsonl\n M autoResearch/studies/speed-up-check-all-movies/state.json"}, "id": "decision-0eb0c9ca", "metric": 7.758043, "metric_name": "mean_wall_clock_seconds", "run_id": "20260630-065146-80383e82", "session_id": "session-20260630-065034-aaa6b660", "status": "discard", "worker_id": null}
{"contract_hash": "8ce024da65cb6f4e", "created_at": "2026-06-30T03:54:02Z", "description": "cycle 7 discarded: worker DB connection reuse regressed mean_wall_clock_seconds to 7.055444", "git": {"branch": "autoresearch/speed-up-check-all-movies-20260630-resume", "commit": "4b4ed60", "status": "M autoResearch/studies/speed-up-check-all-movies/decisions.jsonl\n M autoResearch/studies/speed-up-check-all-movies/runs.jsonl\n M autoResearch/studies/speed-up-check-all-movies/sessions.jsonl\n M autoResearch/studies/speed-up-check-all-movies/state.json"}, "id": "decision-a33f3cf2", "metric": 7.055444, "metric_name": "mean_wall_clock_seconds", "run_id": "20260630-065324-02c3fd91", "session_id": "session-20260630-065034-aaa6b660", "status": "discard", "worker_id": null}
{"contract_hash": "8ce024da65cb6f4e", "created_at": "2026-06-30T03:55:46Z", "description": "cycle 8 kept: reusing loaded item rows improved mean_wall_clock_seconds to 5.465497", "git": {"branch": "autoresearch/speed-up-check-all-movies-20260630-resume", "commit": "8fa5d29", "status": "M autoResearch/studies/speed-up-check-all-movies/decisions.jsonl\n M autoResearch/studies/speed-up-check-all-movies/runs.jsonl\n M autoResearch/studies/speed-up-check-all-movies/sessions.jsonl\n M autoResearch/studies/speed-up-check-all-movies/state.json"}, "id": "decision-705762ee", "metric": 5.465497, "metric_name": "mean_wall_clock_seconds", "run_id": "20260630-065508-feb18fe4", "session_id": "session-20260630-065034-aaa6b660", "status": "keep", "worker_id": null}
